8,2337,2019,3,1,4,"Customers provide interested suppliers self-registration link accessible via their website portal or mail the suppliers. Interested supplier registers in the Supplier portal, their profile is processed, and the customer is capable of deciding whether to approve or reject their profile. Additionally, Supplier Pre-Qualification can be performed on the suppliers which facilitate the approval process of Potential Suppliers. If their profile is approved, they are initially awarded a Potential Supplier status. Approver can asks for more details to be certain about the supplier, and potential supplier is also asked to directly edit their profile and submit it to the approver through the Supplier Portal. When the approver is satisfied with the potential supplier‘s profile, it brings potential supplier on board as a new supplier which is termed as an Operational supplier. 
Suppliers provide information as per customer’s request. However, if customers need suppliers to fill any extra information that is more supplier specific, customers can create conditional forms. Conditional questions help add more value and concrete information to critical supplier profiles. Conditional questions are kept hidden initially from the suppliers, only after making relevant selections the conditional questions appear to the suppliers. Based on the same technique, customers can create extensive category based forms by designing a conditional questionnaire.
Once the supplier fills the online form/scorecard, workflows come into play where the supplier registration request is routed to the autorized users for approval. The approval manager can ask the supplier to upload documentations, certifications etc. as required.",3
8,2338,2019,3,1,4,"We are currently building ML powered Supplier Onboarding RPA BOT that would automate the supplier onboarding process, identify risks associated with suppliers and automatically move them through the onboarding workflow",2
8,2339,2019,3,1,1,"Zycus provides a self-service supplier portal where suppliers can log in and manage their own profile data. The Zycus Supplier Network (ZSN) is free to use. Suppliers will have access to all orders and invoices from the portal. They can take actions, acknowledge orders from the portal, manage their information, upload documents etc.  All suppliers receive an email notifications for events. One of the core functionalities of iSupplier, the 'Collaborate' Tab allows buyers to work closely with the suppliers and send alerts to them both manually and or to define business rules to trigger and send alerts to suppliers automatically. The Zycus Supplier Network is free to all suppliers so that all customer's vendors can access the portal and no barriers to entry are created with unnecessary supplier fees. Buyers can also keep a log of all supplier communciation by making a note on supplier profile.",1
8,2340,2019,3,1,4,"Zycus is currently developing ML powered BOT for automatic detection of documents, their content and identifying associated risks",0
8,2341,2019,3,1,4,Zycus iSupplier can incorporate any amount of information as required by the customer. Different fields can be created and supplier can be asked to provide information.,2
8,2342,2019,3,1,3,Zycus has partnered with NvoicePay to handle payments.,2
8,2343,2019,3,1,4,"Suppliers can upload different documents (certificates, financials, insurance certificates etc.) which can be verified by the relevant teams using workflows. Zycus has also partnered with GRMS for third party validation of insurance and other such documents. We are currently developing ML powered BOT for automatic detection of documents, their content and identifying associated risks",1
8,2344,2019,3,1,2,Different suppliers qualify the preferred status on different parameters. Customers can configure a form that caters in understanding whether the supplier is preferred or not. Often we see customers creating a form based on category or type of spend. These forms help segment suppliers better into preferred or non-preferred status.,2
8,2345,2019,3,1,2,The solution supports robust supplier approval process which can be routed to different stakeholders to review different sections of the supplier profile. Request can be reassigned/substituted to different users as well,2
8,2346,2019,3,1,3,"Zycus solution is capable of capturing not only standard industry codes like UNSPSC, SIC, NAIC, etc. but solution can accommodate custom and hybrid codes as well.",2
8,2347,2019,3,1,3,"Zycus solution is capable of capturing not only standard industry codes like UNSPSC, SIC, NAIC, etc. but solution can accommodate custom and hybrid codes as well.",1
8,2348,2019,3,1,2,"Supplier Performance provides different mechanisms to monitor supplier performance data. All dashboards cater to different purposes to manage supplier performance. 

Solution offers a centralized dashboard which provides visibility to users to track different KPIs vs supplier scorecards, their supplier performances and tracking different supplier development programs. Customers get a bird’s eye view into overall supplier ranking, fair idea of low performing suppliers for different categories, top suppliers and KPI watch list.  Customers can easily export the charts and data for any company level meetings or presentations. Additionally, the common dashboards can accommodate reports across the solution suit to facilitate overall supplier activities visibility. Customers can add more reports in the parametric dashboard. 

Another way to monitor supplier data is while analyzing suppliers at event level or supplier level. Solution offers powerful engine to analyze supplier performance scores providing supplier rank and performance report. Analyze events can be either archived or on going events. Customers can view event details which displays analysis basis the various parameters decided by the event owner. All responses received from scorers can be exported for offline analysis as well. Also, customers view the summary for the entire event and open an already ended event. Customers will have access to event dashboard and performance report; additionally they can track the trend of suppliers using the trend reports. These dashboards provide high level data and if required drill down further to granular level information. 

Zycus has significant strength in the areas of data management, analytics and reporting.  There are multiple analyses and reporting options present within the solution. Each module has its own reporting engine and comes with a set of pre-packaged, best practice reports. In addition, users can easily create comprehensive ad-hoc reports. Performance management solution offers pre-canned reports out-of-box yet allows customers capability to create ad-hoc reports based on any parameter as configured in the system. Customers can view/create and save as well export reports created by them and these can be added to the dashboard for further use. Variety of parameters such as spend, contract, category, SCM related data, and performance and risk scorecards etc. are reportable. Generating new reports involves use of easy drag and drop of various parameters such as risk/spend/facility/performance/category etc. These reports can also be displayed on the dashboard once created and also alerts and reminders can be set for each report. Few of the prepackaged reports available out-of-box ;

1. Supplier Rank – View the scores of the suppliers grouped by their rank
2. Supplier Category – View the scores and the spend of the suppliers grouped by category
3. Supplier Programs – View the details of all the programs running for the suppliers
4. Scorecard – View all the scores for all the scorecards used to measure the suppliers

Additionally, Zycus offers OneView which is an overall supplier report card to track overall business activities and spend with suppliers. Customers can easily track the events, contracts and purchase orders with the supplier, at the same time monitor spend & performance of the supplier.",1
8,2349,2019,3,1,2,"Supplier Performance provides different mechanisms to monitor supplier performance data. All dashboards cater to different purposes to manage supplier performance. 

Solution offers a centralized dashboard which provides visibility to users to track different KPIs vs supplier scorecards, their supplier performances and tracking different supplier development programs. Customers get a bird’s eye view into overall supplier ranking, fair idea of low performing suppliers for different categories, top suppliers and KPI watch list.  Customers can easily export the charts and data for any company level meetings or presentations. Additionally, the common dashboards can accommodate reports across the solution suit to facilitate overall supplier activities visibility. Customers can add more reports in the parametric dashboard. 

Another way to monitor supplier data is while analyzing suppliers at event level or supplier level. Solution offers powerful engine to analyze supplier performance scores providing supplier rank and performance report. Analyze events can be either archived or on going events. Customers can view event details which displays analysis basis the various parameters decided by the event owner. All responses received from scorers can be exported for offline analysis as well. Also, customers view the summary for the entire event and open an already ended event. Customers will have access to event dashboard and performance report; additionally they can track the trend of suppliers using the trend reports. These dashboards provide high level data and if required drill down further to granular level information. 

Zycus has significant strength in the areas of data management, analytics and reporting.  There are multiple analyses and reporting options present within the solution. Each module has its own reporting engine and comes with a set of pre-packaged, best practice reports. In addition, users can easily create comprehensive ad-hoc reports. Performance management solution offers pre-canned reports out-of-box yet allows customers capability to create ad-hoc reports based on any parameter as configured in the system. Customers can view/create and save as well export reports created by them and these can be added to the dashboard for further use. Variety of parameters such as spend, contract, category, SCM related data, and performance and risk scorecards etc. are reportable. Generating new reports involves use of easy drag and drop of various parameters such as risk/spend/facility/performance/category etc. These reports can also be displayed on the dashboard once created and also alerts and reminders can be set for each report. Few of the prepackaged reports available out-of-box ;

1. Supplier Rank – View the scores of the suppliers grouped by their rank
2. Supplier Category – View the scores and the spend of the suppliers grouped by category
3. Supplier Programs – View the details of all the programs running for the suppliers
4. Scorecard – View all the scores for all the scorecards used to measure the suppliers

Additionally, Zycus offers OneView which is an overall supplier report card to track overall business activities and spend with suppliers. Customers can easily track the events, contracts and purchase orders with the supplier, at the same time monitor spend & performance of the supplier.",1
8,2350,2019,3,1,4,"Zycus has successfully implemented its solutions over the years with multiple systems and ERP’s such as SAP, Oracle, other modules and systems in organization for seamless data exchange between systems. Zycus has an open integrations platform called iConsole which enables our solutions to integrate readily with multiple ERPs. Zycus supports both synchronous (real-time) integrations via industry-standard REST API protocols and asynchronous (batch) integrations via files. The API can be used to get the data in JSON (JavaScript Object Notation) format which can be used to push it to/ pull from any custom source systems or to develop mobile clients or Web 2.0 widgets.  Typically, our customers use iConsole APIs to interact with the comprehensive suite of Zycus products, extract the data on a scheduled basis and in a standardized manner. This gives our customers complete control over the data sync frequency. iConsole APIs are a great way to save on the development efforts. ",2.5
8,2351,2019,3,1,0,This is not applicable to Zycus since we do not have a network offering,0
8,2352,2019,3,1,2,"Supplier Management solution captures multi-tier data for suppliers. Multi-tier data management is broadly extensible. Buyers can configure parent-child relationship for suppliers add data based on the multi-tier format. The supplier profile form can be created in such a way that can capture information which is simple but complex data formats can also be handled. If there is risk involved for suppliers, based on the risk data can configured on the supplier information form. 
Apart from supplier multi-level data, Zycus offers spend analysis solution that allows drill down into reports to get granular view into all type of spend reports. Additionally, drilling across the reports is also possible by the buyers to get access to other parametric reports. Buyers get access to transactional data through the spend analysis reports & charts. ",1
8,2353,2019,3,1,2,"The solution supports accounting structures, org hierarchies, budget period, budget categories and payment terms.",2
8,2354,2019,3,1,2,"The solution supports configurable forms, which can display fields differently to suppliers based upon supplier, industry, category, geography or any other condition",2
8,2355,2019,3,1,2,"Zycus offers highly configurable supplier relationship management solution. Evidence of configurability is witnessed in supplier registration forms, on-boarding customer workflows , customized KPI’s & scorecards  etc. 
Customers can add as many profile fields as per their business requirements. Customers can easily capture supplier basic business details like company information, location, products/services, spend information, purchasing information etc. There is industry specific information that is extremely important to companies and is mandatorily captured as part of the supplier information. To quote a few examples HIPPA compliance, ISO compliance, Certificate of insurance, Conflict minerals etc. are provided by all suppliers to Zycus customers. Customers can create as many sections as needed and configure as many fields as possible. There is no limitation on the number of fields that can be configured on the supplier registration form. The registration forms can be conditional forms as well depending on the type of information to be captured.

Every time a supplier requests for registration or a supplier is created by the buyer, it is advisable to route the request through selected members in the organization for a quick check and assurance. In order to route the request customers design workflows in the solution. The workflows are extremely configurable and dynamic that can easily capture simple to complex organization hierarchy. Rule driven workflows can be built on the basis of users, roles, designations, departments etc. Workflows are routed depending on different conditions & parameters set by customers. The workflow editor provides a simple, easy-to-use drag-and-drop functionality to create workflows that allows configurations. 

Customers can create pre-qualification scorecards for supplier on-boarding. The scorecard can be customized as per the business requirement of customers. There are no limitations on the number of questions or the formulae used to measure the score. The scoring mechanism is used as a pre-requisite for supplier on-boarding. 
",1
8,2356,2019,3,1,3,"In addition to the various reporting options, the onbaording capability and the performance management charachterisitcs described in the RFP, Zycus empowers supplier account managers with a tool which collects data from each Zycus solution to display it at their fingertips. Zycus OneView combines procurement data from the various modules across the Zycus Source-to-Pay suite into a consolidated view pertaining to a supplier to support strategic decision-making processes in a single search.  The OneView search aggregates supplier data from the different modules in a single view providing:
• Up-to-date Spend Analysis spend visibility for the supplier with the functionality to drill into spend metrics for deeper analysis.
• Complete iContract contract data for a supplier at your fingertips with the ability to drill into individual contracts for research.
• Access to all iSupplier and iPerform supplier performance tracking information with drill down capability. 
• Full iSource sourcing event visibility for a supplier with event-level drilldown functionality for events that they participated in and ones that they were awarded
• Zycus Procure-to-Pay purchase orders mapped against a supplier with all details for the purchase orders and requisitions raised
• iSupplier facilities view via Google maps of a supplier to identify potential Supply Chain risks
• Comments and feedback captured by users for the supplier via iPerform in a comment box for reference
• Mobile support for Apple iOS and Android devices for OneView viewing and approvals",2.5
8,2357,2019,3,1,3,"This can be accomplished by defining a supplier innovation template as a sourcing project. These challenges can be instantiated from PR brought in from ERP/MRP solutions containing Bill of Materials/items, which can be sent across to the supplier for their response. These events would also support stakeholder scoring and workflow approvals",2
8,2358,2019,3,1,2,"As described above, challenges can be executed using sourcing events which have workflow approvals and scoring",2
8,2359,2019,3,1,3,"Zycus offers a highly configurable request management solution. An innovation requet form can be configured for suppliers, which can include any number of fields, attachments and other parameters. Users can further create innovation challenges, by using the sourcig solution, on such requests.",1
8,2360,2019,3,1,3,The sourcing solution supports extensive workflows and advanced collaborative scoring for managing events.,2
8,2361,2019,3,1,3,"Zycus supplier network offers suppliers a single UI to transact and collaborate with all Zycus customers. The supplier user has their own dashboard, which can be customized. Users get alerts and notifications on the UI as well as over email and on the supplier application. The solution carries over its intuitiveness and user-friendlyness from the buyer side, which enables suppliers to execute all tasks on the solution",2.5
8,2362,2019,3,1,1,"Zycus provides more of a collaborative platform for product management. Zycus Project Management solution iManage allows managing, tracking and monitoring projects through a single central platform. To get a single bird's eye view at all on-going projects, Zycus iManage solution allows users drill down into project phases and tasks. Project owners can easily assign tasks and monitor progress for these projects. Level of Project assignment can vary to owners / divisions / categories / etc. simultaneously. Powerful Reports can be created on the status / spend of all on-going projects or programs. Additionally, a dashboard is provided for getting a high level view of the progress of all projects. Zycus iSoucre supports BOM structures through flexi tables. Different parent child structures are supported on the flexi table and used in sourcing events as the pricing table. The sourcing solution can be linked to projects to track the progress of the sourcing solution. 
Zycus provides an advance module called iCost which augments with the spend analysis solution. It’s an innovative application that provides organizations visibility into various market pricing trends. In addition, customer can analyze their internal data (spend, prices etc.) in context of the external market behavior. Organizations can closely monitor the factors which affect the prices of various spend categories/items and accordingly align their sourcing strategies to benefit the most from fluctuating market conditions. Powered by smart algorithms that enable stark and fact-based analysis, iCost provides an easy and effective means to identify and realize advanced savings opportunities. However, Zycus does not provide should cost models and real time market data tracking.",1
8,2363,2019,3,1,1,"Zycus sourcing solution supports BOM structures through flexi tables. Flexi tables are extremely useful for manufacturing companies with complex pricing structures. Different parent child structures are supported on the flexi table and used in sourcing events as the pricing table. The sourcing solution can be linked to projects to track the progress of the sourcing solution. Flexi item tables can be created on excel format and the formulae can be customized based on the total cost of ownership. Entire item table is mapped on the solution through simple import. Once the item table is added to the solution, sourcing managers can easily run a sourcing event. ",1
8,2364,2019,3,1,1,"Zycus provides a collaborative platform for NPI/ NPD processes. Zycus Project Management solution iManage allows managing, tracking and monitoring projects through a single central platform. To get a bird's eye view at all on-going projects, Zycus iManage solution allows users drill down into project phases and tasks. Any new product development will require a phase wise mechanism to track & monitor progress of the new product development project. Project management workflow tightly integrates or includes the end-to-end sourcing cycle: from event creation to awarding business to suppliers. Our solution intelligently auto-updates sourcing event progress, contract creation progress and any internal request progress against the procurement project. Project owners can easily assign tasks and monitor progress for these projects. Level of Project assignment can vary to owners / divisions / categories / etc. simultaneously. Powerful Reports can be created on the status / spend of all on-going projects or programs. Additionally, a dashboard is provided for getting a high level view of the progress of all projects. ",1
8,2365,2019,3,1,3,"Zycus provides a collaborative platform for NPI/ NPD processes. Zycus Project Management solution iManage allows managing, tracking and monitoring projects through a single central platform. To get a single bird's eye view at all on-going projects, Zycus iManage solution allows users drill down into project phases and tasks. Any new product development will require a phase wise mechanism to track & monitor progress of the new product development project. Project management workflow tightly integrates or includes the end-to-end sourcing cycle: from event creation to awarding business to suppliers. Our solution intelligently auto-updates sourcing event progress, contract creation progress and any internal request progress against the procurement project. Project owners can easily assign tasks and monitor progress for these projects. Level of Project assignment can vary to owners / divisions / categories / etc. simultaneously. Powerful Reports can be created on the status / spend of all on-going projects or programs. Additionally, a dashboard is provided for getting a high level view of the progress of all projects. ",2.5
8,2366,2019,3,1,3,"Zycus has significant data integration capabilities. These include file based integrations as well as API based integrations, through our centralized integration platform iConsole. We have worked hard over the years to make the platform easily extensible and integratable. 

zDoc is Zycus' specification standard for all integration methods, which enables repeatable, scalable and simpler integrations. It is a set of specifications primarily used for publication and consumption of data between the Zycus suite and other applications.

To support multi-ERP integrations, Zycus has developed ZIA, an end-to-end data transformation and integration solution  which can be controlled over the cloud by Zycus. This brings cost advantages compared to commonly available middlewares and is easy to adapt.

We have developed a Third Party Integration layer, internal intermediate component between Zycus products and third party partner services such as OCR, EDI, eSignature providers, amongst others to provide true flexibility to customers for choosing the third party services they like, along with the Zycus suite of products

We have also developed Integration Monitoring Tool, a home-grown  solution with a proactive ‘Monitor – Resolve – Prevent’ approach for simple and error-free integrations.
 
Addionally, we have adopted Swagger, an open-source software framework backed by a large ecosystem of tools that helps developers design, build, document, and consume RESTful Web services.",2
