7,1,2019,3,1,5,"The CCW Match Index Intelligence uses artificial intelligence-based natural language processing and unsupervised machine learning algorithms to determine the match of candidates' resumes to requirements and then compare and bucket the candidates. This is not a standard keyword search but an AI-based algorithm which does contextual analysis.

AI/Machine learning is also used for market demand analysis and to classify the requisitions scraped from the different job boards and corporate sites for cognitive learning about the skill demand in different geographies.",5
7,2,2019,3,1,5,"The purpose the machine learning algorithms in CCW is to track and advise on candidate matches, rate guidance and decisions regarding  the type of procurement (e.g. contingent worker, service procurement etc.). The actions taken by the user after providing the guidance is tracked, and used to determine the effectiveness of the guidance.",5
7,3,2019,3,1,5,"Algorithms are key part of Coupa Contingent Workforce. These are used to drive decisions in key processes including but not limited to determining the right requisition type, sending actionable notifications to right receipients like for tenure violations, missing timesheets, pending requisitions etc. , applying runtime validations when timesheets are being entered, deciding the next approver in the workflow etc.",5
7,4,2019,3,1,5,"Coupa Contingent Workforce captures, analyzes and retains all data entered into the system.  
It allows customers to capture extensive non-financial & financial information about requisitions, candidates, contingent workers  their engagements, SOW based projects and suppliers. Transactions like timesheet, expenses, invoices, payments capture extensive data points for the product & its users to make informed decisions.

In addition, it creates a history (date and time stamp, user conducting transaction) of every record's original creation and update; every transaction's submission, change and approval; every interface to external applications (e.g. validation of charge# with ERP systems, submission of invoice, update of organization hierarchy etc.), every mass update (file upload or call of import/export API), and every report creation (including the users and parameters used for the report).  Audit trails of all transactions are viewable as logs and/or reports.

We have full backups on a daily basis during off-hours.  In addition, we also conduct differential backups every hour and a transaction log backup every 30 minutes.  All upgrades and patches also require a full backup prior to applying the patches. The data is stored onsite and then moved offsite at the end of every month. The full and incremental backups are retained for 3 months. Thereafter, only the full backups are retained for another 6 months and then the backup is stored and archived in AWS glacier for long term access and audit.  CCW uses Amazon Simple Storage Service (Amazon S3) as the cloud backup storage provider.

Transactional data is archived every quarter if it is older than 7 years. However, for reporting, the data warehouse always contains the data and it is not purged. Archived data is available for reporting through the data warehouse cubes. However, if the archived data needs to be restored for other transactions, the restoration can be completed within 3 business days after request.",4
7,5,2019,3,1,4,"Coupa contingent workforce allows data to be exported on demand at different customer interactions for e.g. exporting grids after searching & filtering the required records e.g. for contingent workers. File extracts be scheduled to run any number of times at user defined frequency like minutely, hourly, daily, weekly, monthly. Data can be exported by authorized users in different formats such as Excel, PDF, or CSV formats. In addition
In addition, Coupa Contingent Workforce allows extraction of key data concepts like requisitions, candidates, workers, projects etc. as ""data cubes"" with extensive set of fields which customers can use to feed into their own data lake/ware houses. The data cubes are exported in XML formats.",3
7,5,2019,3,2,,,4
7,6,2019,3,1,5,"Coupa Contingent Workforce ""Adhoc Reports"" module allows authorized users to build their own queries and  defining their own extracts. In addition to that, user can also define their own dashboards by choosing various metrics & KPI's they would like to track & extract them at on-demand basis",3
7,7,2019,3,1,5,"Coupa Contingent Workforce provides the ability to search on all standard and custom fields. The text fields are searchable with ""contains"" clause. The standard fields are searchable with drop down/type ahead searches. Resume attachments are also searchable. Filters can also be applied to transaction types, locations, or any other type of filter that provides views of different levels of activity from the enterprise to the individual. All stored documents and links have tags or names which allows them to become searchable and provide a reference.  CCW queries can be saved, enabling clients to create snapshots of data at a given time, with anytime access, to report and analyze trends over time.",3
7,8,2019,3,1,5,"Using CCW's ad hoc report generator, custom reports can be generated in which data is simultaneously searched and sorted against three criteria. This provides detailed reports indicating topic, scope and time frame. Any field, including all custom fields, can be included in a CCW report. The report generator is similar in style to pivot tables, making it easy for all authorized users to quickly generate an ad hoc report. The client and/or MSP does not require the services of Coupa or their internal IT staff to generate custom reports. Access to data and to the ad hoc reporting feature are determined by the roles assigned by the program administrator.",3
7,8,2019,3,2,,,4
7,9,2019,3,1,5,"Using CCW's integration toolkit, CCW has been fully integrated with PowerBI and RANET and other business intelligence systems as well as data warehousing solutions like SSAS.  CCW has a native integration with Tableau. However, our warehouse integration toolkit offers the ability to deliver data to any BI tool in XML format. It exports the reporting data on a scheduled basis to other warehouse tools for BI and reporting. The warehouse integration toolkit denormalizes the data and exports all new/edits to the external customer's warehouse in the form of XML so that it can be consumed. ​New and updated data can be exported on a daily basis, and CCW can perform multiple exports in a single day.

",4
7,10,2019,3,1,4,"CCW dashboards enable every user to focus on the program elements of greatest importance to their role. Content access is determined by role and customizable default templates are included. Users can fully configure dashboard views from the front end, controlling the layout, charts and tables to be presented, and fields to be included in each without contacting VMS support or an IT department.  Every data point will be available for reporting and analysis, including use of external data from social networking platforms, employment sites, government employment data, and external demographic data, combining it with clients’ statistical data and stakeholder feedback systems to benchmark performance.  Charts and graphs are editable, and notations can be added.  Dashboards provide complete drill-down capabilities (from graphs and charts as well as list views), with the ability to perform all actions directly from the dashboard, often in as little as three clicks.  Dashboards also include real-time synchronized calendars and ‘To Do’ lists, enabling all actions to be taken from the dashboard.",4
7,11,2019,3,1,4,"Service Level Agreements (SLA) are established with every client at program inception.  Because the needs and priorities of each client differs, a formal process is employed to establish SLAs.  It includes the definition of the key performance indicators, the stakeholder/audience being impacted, and the goals/thresholds to be measured.  Metrics are then entered into CCW during initial configuration.  CCW can monitor, analyze and report on any KPI. Most clients elect to include delivery metrics, stakeholder satisfaction measures, compliance measurements to ensure adherence to corporate policies and government regulations, and product performance SLAs that measure CCW availability, hotline responsiveness, and resolution of technical issues.

CCW includes predefined CWM KPIs related to submittal rate, submit-to-interview ratio, submit-to-hire ratio, time to submit, time to fill, diversity, attrition, cost metrics, billing accuracy, and user satisfaction. For SOW-based contract services, predefined metrics that have been found very effective include accuracy in tracking all approvals, change order management, tracking resources against task orders, billing hours by resources against different task orders, expense reporting, and tracking deliverables and invoicing based on different milestones, and tracking of funding allocated to PO/Task order.  In addition, SOW KPIs typically include compliance with onboarding for all resources working on SOW projects, time to fulfill task orders by suppliers, and burn chart tracking for projects.

 
Supplier Scorecard Reports included within CCW can be configured to track up to 25 key client-defined supplier performance measurements.  Clients can weight each metric, generating an overall supplier score and ranking the supplier against the entire supply base or a selected group of suppliers. At the client’s discretion, separate metrics can be configured and contracted with specialty service firms, small businesses, diversity suppliers or short-term providers of service. Clients can establish thresholds for satisfactory performance at the metric level, or overall. Suppliers have access to their supplier scorecards and other reports, enabling them to monitor their performance.

 
CCW, tracks and reports on all established SLAs.  Every transaction is tracked.  CCW provides analytics with the backup detail to monitor and measure the program performance. CCW will also pull data from the enterprise applications that it has been integrated with to provide comprehensive data analysis.  All analytics can be based on different parameters such as service categories, location, business units etc.

Service Level Agreements and KPIs need to evolve with the program to meet the dynamic needs of the enterprise. Planned changes to processes, projects or goals for the upcoming quarter are reviewed, and an assessment of whether the KPIs are effective in helping to measure performance against stated goals is periodically conducted.  Changes are then made to CCW through a simple form change.",3
7,12,2019,3,1,4,"Reports and dashboards are available to MSPs and suppliers. CCW is a role-based system.  When establishing roles and associated permissions, authorization to access reports is indicated. Permissions can be established at a granular level, indicating the data and types of reports to be accessed,  authorization to run ad hoc reports, ability to export data into reports, etc.",3
7,13,2019,3,1,5,"CCW has multiple spend analysis capabilities which allows the users to categorize and classify spend based on skill categories, engagement duration, business units, cost centers etc. Drill down reports provide visibility into spend grouped by different fields.

•        Spend by supplier, job title, worker classification, location, business unit, and other factors
•        Breakdown of labor spend by regular time, OT, expenses, etc.
•        Budget vs. actual spend
•        Reallocation of budgets across project segments
•        'What-If Scenarios' for spend forecasting, resource mix analysis, and bill rate adjustment analysis 
•        Project burn rate analysis
•        Comparisons to prior periods
•        Actual vs. expected cost savings
•        Earned Value Management for SOW-based projects
•        Outliers or anomalies such as Overtime Excess or Cost Center excess
•        Integrations with industry-leading spend analysis modules within ERP systems
•        Identification and rejection of charges against charge numbers that have exceeded the established spend limit or have been closed
•        Rate benchmarking against market rates for pay and bill rates as well as mark-ups.  
•        Reverse auction and counter offer functionality, comparing market-based rates against the supplier’s rate card. The system then tracks the initial offer from the supplier to the final negotiated rate and report it as a savings or cost avoidance",4
7,14,2019,3,1,5,"CCW is exclusively hosted by Amazon Web Services, a public cloud.  We do not offer the system via a private cloud or on premise option.",0
7,15,2019,3,1,5,100% public cloud,4
7,16,2019,3,1,5,"Coupa Contingent Workforce technology architecture utilizes ployglot persistence principles i.e. right persistence (storage) technology for right kind of workload. Transactional and analytical data is stored in Microsoft SQL server configured for high availability & horizontal scalaibility. NoSQL in-memory database ""Redis"" tuned for high availability, performance & scalability is utilized for caching frequently used data . In addition, Coupa Contingent Workforce uses Apache Hbase for storing data required for its ""Big Data"" driven features like ""Match Index"" while MongoDB, a document style NoSQL database is used for storing processed data in json format for easy rendering.  A combination for SSD (Solid State Drive) based file storage and AWS S3 is used for storing datasets required for bulk processing e.g. for file based integrations while AWS ""Glacier"" storage mechanisms is used to archive infrequently used files & datasets",4
7,17,2019,3,1,4,"
Coupa Contingent Workforce applies analytics capabilities to match candidates against requests using the unstructured data captured in the job description, required skills and the resume. It also can parse & analyze resume's to extract out supplier names enabling customers with vendor neutral programs to process resumes without having to manually scan each of them to identify & remove supplier names.",4
7,18,2019,3,1,4,"CCW provides extensive support for “Big Data” from volume & variety perspective. It processes extensive amount of structured data like transactional data and unstructured data like resumes, job description etc. Examples include
•        Use the data to rate the effectiveness of different talent acquisition sources.
•        Establish benchmarks by comparing contingent workforce management program performance to market standards.  Conduct quarter-to-quarter trend analyses and use this data to predict future demand and performance.  
•        Examine the workforce overall, as well as by location, department, supplier and/or hiring manager. Hone in on the outliers.  
•        Natural Language Processing is used to assess the hiring decisions of each hiring manager, identifying trends and preferences that are indicators of the intangible qualities of a “best fit” candidate
•        Evaluate reported issues/inquiries to identify emerging client needs and product areas needing enhancement
Our searches and filtering are based on an in-memory database, which gives the system near real-time processing speed. The database consists of a HBASE on Linux for the analytics with Microsoft SQL Server for transactions.
CCW is a multi-tenant SaaS product hosted in the cloud by Amazon Web Services (AWS) and data access is managed using Tenant View Filter. This maintains a single codebase and a single instance on the cloud.
AWS has implemented security management processes, PCI controls, and other security controls designed to isolate each customer from other customers. AWS systems are designed to prevent customers from accessing physical hosts or instances not assigned to them by filtering through the virtualization software. Clients are isolated and partitioned using their data attributes and custom configuration so data is not shared in the same tables.",3
7,19,2019,3,1,4,"Business-specific terminology may be configured based on customer requirements.  In addition, the product offers configurable Guidance Text to include customer's data descriptions.",3
7,20,2019,3,1,4,"CCW automatically checks for missing data or data that does not fall within established thresholds or format types, alerting the user of the error and preventing processing until corrections are made. 

",3
7,21,2019,3,1,5,"Our technology stack consists of a multi-tier, service-based architecture with Microsoft's MVC-.NET framework coupled with Python and Angular.js. The entire front end is responsive bootstrap compatible design.",3
7,22,2019,3,1,5,"Our technology stack consists of a multi-tier, service-based architecture with Microsoft's MVC-.NET framework coupled with Python and Angular.js. The entire front end is responsive bootstrap compatible design.",3
7,23,2019,3,1,5,"Security is provided at the physical security, network security, and application security levels. CCW is hosted by Amazon Web Services' (AWS) world class data centers. AWS offers Coupa a redundant SAS70/SSAE16 certified infrastructure and ensures complete reliability, scalability and security along with multiple availability zones in different regions. For security purposes, Coupa and Amazon do not reveal the locations of these data centers.  AWS offers enhanced security tools and features:
•        VPC (Virtual Private Cloud): All assets are hosted within VPC and can be only accessed via a secure VPN tunnel. VPC traffic goes through single internet gateway.
•        Subnets: VPC is further broken down in high available Subnets access to which can be controlled via ACL rules for both inbound and outbound traffic.
•        EC2 (Elastic Cloud Compute): All assets (including webservers) have private IP addresses and are contained within Security groups (Software firewall)
•        Elastic Load Balancer: External service that has rotating IP address and allows users to connect only via HTTPS URL.
•        S3 Bucket: high durable, scalable and secure object bucket that allows us to encrypt store objects such as backups and static content.

Intrusion detection sensors report events to a central security management system. CCW is a role-based system, with user access controlled by role and through password management.  Data is encrypted in transit and sensitive data is also encrypted at rest.  We use symmetric encryption based on AES-256 algorithm. Keys are configured separately for each client. The backups and static objects are stored in S3 in an encrypted format using AES-256. We use Amazon EBS encryption to encrypt EBS volumes attached to EC2 instance (server).  Data in motion is also encrypted. PGP/RSA is used to encrypt the files during staging and transfer. CCW uses SSL certificate and all the information submitted by the user is encrypted using AES 256 bit encryption using TLS 1.2.  IIS application pool identify is used for the application to connect and authenticate against the database.  PII data is not used or stored by CCW unless requested by the client.  CCW automatically scans all files prior to upload, and quarantines, cleanses, and blocks specific file types using up to date malware signatures at the application layer.

Our data centers are housed in nondescript facilities. Physical access is strictly controlled both at the perimeter and at building ingress points by professional security staff utilizing video surveillance, intrusion detection systems, and other electronic means. Authorized staff must pass two‐factor authentication a minimum of two times to access data center floors. All visitors and contractors are required to present identification and are signed in and continually escorted by authorized staff.
Client data has never been breached. ",4
7,24,2019,3,1,,"CCW was designed to maximize adoption through ease of use.  Some of the many features incorporated into CCW to improve efficiency include:
•        Help Features:
-        ""Quick Start"" circles on the landing page that take the user directly to the desired action
-        'Trust but Verify' feature requests confirmation before committing any action.
-        'Active Guidance heart beats' provides diagrams of current stage and next steps.
-        'Record Memory' populates fields with previously entered values.
-        'Help Yourself' provides context-sensitive user help for every work step.
-        Error checking and system validations prevent mistakes at the source.  Limits and thresholds can be set for appropriate fields to ensure compliance to business policies. 
•        Role-based system in which users only see those modules, pages and fields relevant to their role assignments
•        “Smart Forms” feature enables the creation of custom forms and tables with multiple sections, workflow controls, and the ability to pull data from multiple sources. The system enables authorized users to select data sources, design the form/table from a template or from scratch, then establish workflows for approval or processing.   Customer-specific fields can be added to any table or form.
•        Wizards and Decision trees to aid in selecting the optimal type and source of non-employee 
•        Auto-synchronization with Outlook and other standard email calendar systems enables clients and suppliers to receive alerts and perform tasks without having to log into CCW
•        Templates for requirements, Statements of Work and job descriptions significantly reduce administrative time and effort.
•        A rules-based system in which modification is simply a matter of changing a setting 
•        Single, scalable platform for managing all types of non-employees 
•        Configurable, role-specific dashboard with complete drill-down capabilities and the ability to perform any function from the dashboard; ability to create requisition in 3 clicks
•        Ability to attach an audio file to a requisition
•        Gamification to encourage adoption 
•        Online chat facilities 
•        Ability to enter requisitions via voice command 
•        Complete functionality on iOS and Android mobile devices",4
7,25,2019,3,1,4,"Coupa takes an iterative and user-based research design approach, leveraging opportunities to interview and observe end users using our system.  This provides guidance on each of our UX designs to ensure maxium user adoption and frictionless experiences.  Our fundamental belief is that the best UI is no UI, so in addition to a strong UX, we implement systems that are prescriptive and automate tasks for our users whenever possible.

Coupa User Experience Design is the process of ensuring customer success by improving the usability, accessibility, and pleasure of the interaction between the user and Coupa company, services and products.  We believe in four UX Principles:

1. Innovation - Just build better experiences
2. Ease of Use - Expected behavior, no training
3. Consistency - Learn once, use everywhere
4. Simplicity - Best UI is no UI

We build our navigation, tables and forms with the clarity of showing right information at the high time. We also allow admins and end users to customize these elements to achieve the utmost user efficiency for their specific business processes. 

Our UI elements are consistent across product workflows, so that user can use the same familiar UI approach everywhere.",4
7,26,2019,3,1,4,Our UI framework was  implemented in August 2017. The framework is based on Bootstrap 4.0 and is WCAG compliant.  Our UI is constantly updated and improved through empathic design and user research.,3
7,27,2019,3,1,4,"We have a full UX team that work in close coordination with our customers, product management and front-end developers to deliver the best user experience. For example, in the week this Solution Map response is due, the UX team is meeting with two separate very large customers on day in the life sessions. This is a very common area and our UX team is filled with specialists.",4
7,28,2019,3,1,4,"YES. ​When a user is added to the system, the user receives an email with the URL and user name, and is directed to establish a password.  Configurable password management options include password strength, expiry of password, inactivity blocks (i.e., Users get locked out on incorrect password entry ""n"" number of times with n being configurable for the client), inactivity period, and use of secret reminder clues.  A user can change their own password at any time. 

Standard settings include:
Password strength: Minimum 8 characters, at least 1 capital letter, 1 symbol and 1 numeral required
Password expiry: 90 days
Inactivity period: 15 minutes
Inactivity blocks: 5 tries
Use of reminder clues: 3 clues required

The authentication for mobile apps uses the same user name and password as when accessing CCW from a desktop device, and same WebAPI services for authentication and validation. The CCW mobile can use the SSO token for authentication. Client Users (who do not have a user name and password, since they login to web through SSO) will need to generate the SSO token in the web and then input that token in the mobile. ",3
7,29,2019,3,1,4,YES.  We provide SAML 2.0 based SSO. We also provide Oauth OpenID Connect based SSO.,3
