69,42,2019,3,2,1,"We feel we help the users who require assistance and initiate help through our Guide Me decision support module. The client can configure a series of questions, answers, and end points to guide users to specific recommendations and actions, which is known as decision support. Providing guidance improves client user confidence and can ensure more accurate execution which can help to preserve data integrity.",1
69,43,2019,3,1,0,N/A,
69,44,2019,3,1,0,N/A,
69,45,2019,3,1,0,N/A,
69,46,2019,3,1,5,"We have a professional services team that assists with the implementation of the tool. With the implementation you are assigned both a project manager and functional consultant on top of access to our solution consultants and integration specialists as needed. We take our clients through five key implementation steps: Discovery, configuration, implementation, acceptance, and go-live. As we develop the ideal configuration for our customers based on their business rules we have them sign off along the way. during the implementation we provide training to admin, reuglar users, and vendors to ensure everyone is familiar with the technology. We can bundle implementations based on spend or we can create an SOW for the entrie project.",3
69,47,2019,3,1,4,We have an integration team that specializes in designing integrations to work with other internal systems the client is using. During implementation we scope the integrations to determine if we already have a standard created or we can develop custom integrations based on the need of the clients. Whether we are using a standard or designing a new integration we make sure to test the integrations before go-live. Standard integrations come at no cost the the client while custom integrations can incur a fee.,3
69,48,2019,3,1,4,"Our integration team not only specializes with the integration with internal systems but with 3rd party applications today. We have many clients that integrate their applications with third party applicant tracking systems, back ground check providers, etc. based on their business need. We follow the same process as above of defining standards or building custom integrations.",3
69,49,2019,3,1,5,We have a process today to allow for development based off of high impact needs of the clients. If a request comes through that benefits just the client and can be built just for their org we can do the development at a fee. If a request comes through that benefits the entire client base we will design and develop the enhancement at no charge.,3
69,50,2019,3,1,4,Each account will have an account representative that they will work with as well as customer support for technical questions. For the organizations we manage directly we provide what we call Shared Managed Services. This service allows clients to choose from an a la carte menu of what services they would like us to provide for them and which they would like to manage in house. ,4
69,51,2019,3,1,5,We have a customer portal that our clients can log into to access documentation and frequently asked questions. Customers can also submit enhancement requests and change requests into this portal as well for review by the product team.,3
69,52,2019,3,1,4,"We have a support desk that is available from 2AM EST - 8PM EST. We do have SLAs surrounding the severity of the ticket. Any serverity 1 tickets will be addressed immediately. Support can be contacted through a variety of different mediums including email, phone, and through the customer portal. Our support is located around the globe to provide the best service to our clients. Support is included with the utilization of the software.",3
69,53,2019,3,1,4,We have a custom forum that allows customers to enter and ask questions of one another. We also have searchable online help that has the full documentation of the application that can help them find the answers to the questions directly in the application.,3
69,54,2019,3,1,5,"We have what we called Shared Managed Services to provide next level support on top of our technical support. With Shared Managed Services the client hand picks the services they would like us to complete on their behalf and which ones they feel they can manage in house. Some sample services we provide are rate rationalization, spend analysis, vendor ptimization, quarterly business reviews, custom report writing, and more. We see a very high success rate with this program because customers are only paying for the items they need and not every service under the sun.",4
69,55,2019,3,1,2,Our system will allow for the tracking of the candidate type but it does not check for the risk assoicated to the candidate. With that said we do have the ability to integrate with third party services that provide this level of service if requested by the client.,0
69,56,2019,3,1,3,As VectorVMS tends to steer clear of the MSP space we do not take on any type of contract execution on behalf of our client. The tool is a great place to store any type of contractual terms or documentation and we have many places within the application where it can be attached. We can track if a contract has been completed or if terms are coming up on expiration but we do not execute or provide legal help in writing contracts.,0
69,57,2019,3,1,0,As VectorVMS tends to steer clear of the MSP space we do not provide payrolling services for our client. We are technology only and are not tied to a staffing agency making us a truly neutral technology. We can provide consolidated invoice and payment on the clients behalf but we do not provide payrolling services.,
69,58,2019,3,1,0,See above (N/A),
69,59,2019,3,1,,Our clients handle invoicing through a few different avenues.,
69,59,2019,3,2,3,We provide consolidated invoice and payment to our direct clients that would like us to manage the invoice process on their behalf. The fee for this service is bundled in with the technology. We also provide reconcilliation with vendors on behalf of the client.,4
69,60,2019,3,1,4,"With VectorVMS you get as many license to our reporting environment as needed. This is a great way to use the data to understand your spend analytics, process optimization opportunites, rate rationalization, manager involvement, etc. The licenses to the technology and the reporting environment are one in the same. The only time there would be an additional increase in cost is if the client wanted to utilize one of our technical writers or program managers to help them write and maintain their reports.",2
69,60,2019,3,2,3,"Using our Shared Managed Services model our clients can take advantage of our expertise by using an a la cart menu to decide which services they would like us to complete, one of which being the data analysis. On top of writing the reports we conduct weekly meetings with these clients to talk about whatever data they are trying to capture whether that is fill times, market pricing, process flows, spend analysis and provide our advice and best practices with this data. This allows clients to determine what data they care about and we do the heavy lifting to get it to them.",4
69,61,2019,3,1,4,We have standard integrations in place today that allow us to point our requisitions to any sourcing system the candidates would like to utilize as well as pull in candidates from these third party system. We have a standard integration today with our sister company PeopleFluent to integrate with their ATS. We also work with many other ATS out their to get the order pushed through many different avenues. Depending on the request of the client we can/have integrated with many sourcing services.,0
69,61,2019,3,2,,See separate response,
69,62,2019,3,1,4,"Our system has different areas in the workflow that allows for the curation of the talent. The first is through the skill section. Through our required skill section the vendor has to put in the skill set of the worker and we provide matching against the candidate skill set to the skill set on the requisition. We also have a robust compliance manager that ensures that the candidate has the right compliance to be onboarding (back ground checks, drug screenings, healthcare license, etc.). Through our templates at implementation the users will have all this information defualt for them requsting talent. This is all built into the application and is included with the technology fee.",0
69,62,2019,3,2,2,"Using our Shared Managed Services model our clients can take advantage of our expertise by allowing us to help them managed compliance and background validation, helping them define their requirements based off best practices we have seen with other clients, and using the technology for references. As the technology we stay away from heavy operational tasks typical of the MSP so that is why I did not make us a three but we do help them define theses items and support them as needed.",3
69,63,2019,3,1,0,As VectorVMS we avoid providing typical MSP functions. While the vendor can add themselves as an independent contractor in our system we steer clear of providing them any type of additional service. We are a technology company soley and this has helped us remain a neutral option in the market.,
69,63,2019,3,2,,,0
69,64,2019,3,1,4,We are always looking to make our application work to meet the globalization needs of our clients. We have created a standard process for adding new countries to our application but we tend to do them as they become necessary to our clients. ,
69,65,2019,3,1,4,"The system is available in English-US, English-UK, French, French Canadian, German, Portuguese-Brazil, Spanish, and Spanish-Mexico.  If you require additional language(s), we will be happy to discuss your requirements with the customer. VectorVMS localizes our solution for currency and language level. Should a new country come into scope whose currency or language requirements are not currently met, we will add the language and currency to the solution. Available currencies: US Dollar, Canadian Dollar, Australian Dollar, New Zealand Dollar, Mexican Pesos, Argentinean Pesos, Hong Kong Dollar, Singapore Dollar, British Pound, Japanese Yen, Euro, Venezuelan Bolivar, Swedish Krona, Norwegian Krone, South African Rand, Brazilian Real, Indian Rupee, Chinese Yuan.  Currencies being added: Bulgarian Lev, Polish Zloty, Swiss Franc, Turkish Lira, Emirati Dirham.",
69,66,2019,3,1,3,Same as above.,
69,67,2019,3,1,5,Yes interviews can be set to the time zone of the users.,
69,68,2019,3,1,2,If a contractor has engagement in multiple currencies we create a record for each currency type and have the candidate put time in using the currecy for that record.,
69,69,2019,3,1,,We use a third party software called Avalara to manage our currency conversion for us.,
69,70,2019,3,1,4,Our reporting environment can allow for pulling reports with multiple currencies and a variable can be written in the report to make the currencies allign with one another.,
69,71,2019,3,1,4,Yes. We can generate a payment extract for each currency the client is using. ,
69,72,2019,3,1,5,To date we have been using a third party company for translations that we have a pre-integrated partnership with.,
69,667,2019,3,1,3,The technology provides the ability to store and track important dates around the contracts developed between the client and the vendor. Due to the nature of vendor contracts we have chosen to not provide functionality for creating contracts within the VMS. ,3
69,668,2019,3,1,5,"When a customer wants to add a new vendor to the program they submit a request to us. We look at the vendors and determine if they already exist in our network. If the vendor exists we grant them access to that clients requests so that they have a single log-in for all the clients that they support. If the vendor does not exist a vendor org is created for that vendor. Vendors can be added in an active, inactive, or pending status",3
69,669,2019,3,1,5,Clients can define the type of tiers they want to add their vendors into. Most utilize tiers based on performance but some use tiers for other criteria like diversity and funding types. Clients can determine which vendors are associated to each tier. They can also determine which locations and positions each vendors has access to.,3
69,670,2019,3,1,5,We can define multiple different ways to route requisitions to the supplier community. You can limit which poistions the supplier can receive as well as which locations they have access to. We also support tiering of the vendors so that depending on the tier assigned to the vendor you can route the requisitions accordingly.,3
69,671,2019,3,1,4,To add new vendors into the application our team vets the vendor and assures that they do not already have a profile created with a new customer. If no profile exists today then they are added into the supplier network and provided an org. Vendors will have access in one org to all the customers they service. If a customer would like to remove a vendor from their program they can make them inactive in the self-service admin portal so that the vendor no longer recieves requisitions from the client. The vendor profile can be updated at any time by the client and vendor details can be updated by the vendor themselves.,3
69,672,2019,3,1,5,"Using our reporting environment our customers can easily see metrics around their suppliers. We have two standard reports today that are utilized by the majority of our clients to review the performance of the supplier. These reports provide analytics around the vendor responsiveness, candidate & engagement quality, rate analysis, percentage of spend, volume measures, and more. All reports can be configured as well so we do have many customers that we have created tailored analytics for to measure vendor performance. Rate changes can also be tracked in the application so you always know how your vendor rates are chaning. ",3
69,673,2019,3,1,5,"We have approximately 200 email configurations in the application that allow you to notify the vendor of any updates in the application. This can include any status changes to the requisition, when a contractor has been engaged, when a contract is due to expire, timecard approval notifications, and more can be configured. While we have 200 email notices it is up to the client to determine which emails they would like to configure and which users will receive the notifications.",3
69,674,2019,3,1,5,When a requisition is distirubted to the vendor they will indicate on the requisition how they plan to proceed. This will indicate to the client whether or not the vendor plans to submit candidates or decline participation for that requisition. These fields are reportable so metrics can be kept on how frequently participation is declined on requisitions,3
69,675,2019,3,1,4,You do have the ability to denote on the requisition if a candidate is pre-defined. If you already have a pre-selected candidate you can limit the distribution of the requsition to the vendor that does your payrolling and provide them the details needed to enter the candidate as their own. ,3
69,676,2019,3,1,4,There is the capability to manually select your distribution tiers and routing in the application. The routing of the requisitions for these exceptions can be tracked to see how the requisition was distributed and when it was distributed.,3
69,677,2019,3,1,4,"VectorVMS does have a candidate screening functionality that can be configured to be used by the program manager/MSP to pre-screen candidates. For each user you can determine if they have the ability to see unscreened candidates. Those who can see the unscreened candidates have the ability to review the candidate before they are distributed to the hiring manager creating a shortlist of only qualified candidates. We do generate composite scores to compare the skills defined on the requisition to the skills of the submitted candidate. While the system does not automatically disqualify candidates with low composite scores, the screener can easily see which candidates have low composite scores and bulk reject the candidates that fall below their desired threshold.",3
69,678,2019,3,1,4,"Through our candidate compare functionality users can go through and compare candidates side by side in a baseball card like format. Here they can leave their own rankings of the candidates using the ""My Star"" functionality. If the user needs more information regarding the candidate their is a request that can be sent through the system to the vendor. Every candidate also has a reference section where questions and comments can be made to the vendor and the vendor can respond on the candidate record. Using both the composite scores and their own individual rankings the hiring manager can use the candidate compare for reference when looking to evaluate candidates.",5
69,678,2019,3,2,,,5
69,679,2019,3,1,3,"For each candidate you can set up multiple interviews within the application. For each interview you can add the date, time, interviewer, interview type, and additional comments. When an interview is created it is sent for the vendor to accept. Once the interview is accepted a calendar invite is created and can be added to the users personal calendar. There are notifications that can be triggered to alert that an interview has been created or changed. ",3
69,680,2019,3,1,4,"We never delete any information from the application so that if a worker has previously worked for the organization their evaluations and engagement comments will remain in the application We do have duplicate tracking capability so you can see if a candidate previously worked for the organizatin. The vendors also have the ability to indicate at candidate submittal if the candidate has worked for the client previously. Their elibigiblity status can also be added at the candidate submittal. When looking at the duplicate candidates you will be able to see when they were submitted, who the manager was, and previous rates.",3
69,681,2019,3,1,4,"Candidates are submitted to requisitions through the vendor portal and you can either have them be screened by the MSP/Admin and sent to the hiring manager or are sent directly to the hiring manager for reivew. Rates, dates, and requirements can be updated and relayed to the candidate and the vendor. As conditions arise they can be added to the position",3
69,682,2019,3,1,4,"We have built in different logic to compare the candidates in our ""Candidate Compare"" functionality. Using our composite scoring you can generate a score for how the candidate skill set matches the skillset on the requisition. You can also rank the candidates based on their rates. Each manager can determine which criteria is most important to them whether it is the skill match, how much the resource costs, if the worker has previously worked their, etc. This ranking can be done by manager, by org, and by requisition.",4
69,682,2019,3,2,,,4
69,683,2019,3,1,4,"You can view information about the candidate a couple of different ways. The first is through the resume that can be attached to the candidate profile. The second way to view information regarding the candidate is through the candidate record. On the candidate record you can view the details of the candidate including but not limited to the: candidate name, email, phone number, SSN, and any custom fields that need to be captured. You can also see the skill set of the candidate, the compliance attached and completed for that candidate, their employment history with the client, their rate information, and any other reference comments or attachments. This information can be configured based on what information the client wants to see.",3
69,684,2019,3,1,4,When a vendor submits a candidate it is up to the client whether they want all users to be notified of the new candidate or just the MSP. The MSP can recieve the candidates first and screen the candidates record and resume before allowing the hiring manager to see the candidate. Everything in the system is time and date stamped so you can see when the candidate and their resume has been submitted. ,3
69,685,2019,3,1,4,A budget can be generated when creating a new requisition. This budget can go through an approval process if desired. If the budget needs to be updated this can be done and it will go back through the approval workflow to ensure that the newly adjusted budget is approved by the correct users. Budget can be adjusted and proved after engagement as well.,3
69,686,2019,3,1,5,"You can determine which authority level user has the ability to make changes to an engagement. In the system today if there is an item that will impact the budget associated to that engagement (rate, end date, cost center, etc) the users can determine if they would like to enable engagement change approvals. This way budget impacting changes will have to go through an approval process before they go into effect. The system is time and date stamped so that if changes do occur to the engagement a engagment change history record is created and can be viewed at any time to review engagement changes.",3
69,687,2019,3,1,4,"If there needsw to be an update to the hiring manager or the staffing supplier your admin users will be able to change the hiring manager or vendor associated to the requisition or the engagement depending on what status the worker is in. The current assignment does not have to be terminated it can be transitioned for the hiring manager, a new engagement record would have to be created to update the vendor. With this update an approval process can kick off to approve the transition of the resource to another vendor.",3
69,688,2019,3,1,4,We have a tenure management module within the application that can limit an engagement from extending past a certain amount of time. We also have reporting available to track which engagements are coming close to the defined tenure limits.,3
69,689,2019,3,1,4,The engagement can be transitioned rather than canceled to accomodate changes to the contractors cost center or hiring amanger. To change the vendor associated to the candidate a new record would need to be created. Approvals can be triggered when changing the cost center or any other type of financial code on an engagement to ensure that financial changes are approved.,3
69,690,2019,3,1,5,"Our system has over 220 email configurations within the application. There are many emails that can be configured for the end of a contractors assignment to let users know the end date is 30, 60, 90, etc days out from the last day of the contract. Offboarding compliance emails can be triggered as well to let users know of any offboarding compliance that needs to be completed. If a worker is coming close to X% of the budget as defined by the client an email configuration can trigger as well. ",3
69,691,2019,3,1,5,The whole system is role and permission based so that users can only see the requistions/engagements that they have access to. While an admin user may see all reqs/engts in the application a hiring manager may only see the reqs/engts they were added as a contact on.  Reports can be created to report on reqs/engts and similar to the web application the reporting is based on what the user can view as well. Reporting users can either have access to all the data in the system or just the data that they are affiliated to. The whole system is time and date stamp so all creation and editing of records is kept in a transaction history log that can be reported on. ,3
69,692,2019,3,1,5,Each user can have an alternate user for when they are absent or not available. The proxy can be added or removed as needed and can perform approval and review functions on the behlaf of the hiring manager. The MSP can also have alternate users attached to their profile. Each engagement can have as many alternate time/expense approvers as desired and they can be added or removed as needed.,4
69,692,2019,3,2,,,4
69,693,2019,3,1,4,When submitting the candidate the vendor can add the resume to the candidate profile. Resumes can be downloaded from the application for review. Skill information can also be tracked on the user record and compared side by side with other candidates that have been submitted.,3
69,694,2019,3,1,5,"Yes, onboarding requirement can be configured to meet the requirements of both the position and location.",3
69,695,2019,3,1,5,The system can track all timecards to see what timesheets are outstanding regardless of the status of the worker.,3
69,696,2019,3,1,5,If all required fields have not been entered into the application whent trying to submit an item a error notice will trigger and highlight the items on the page that need to be completed for a page submission to occur properly.,3
69,697,2019,3,1,4,As users are going through the application they will see a workflow to indicate where they are in the process. Fields that are required are highlighted. If the incorrect format is applied for a field a tool tip will appear to let the user know what type of corrections they need to make. We have searchable help available for all parts of the application. Users can also use the Guide Me functionality to point them to the correct locations in the tool for the tasks they are trying to complete.,4
69,698,2019,3,1,4,"There are clear messages that appear for the user to indicate why a page cannot be submitted, a report did not run, an appointment can be made, etc.",3
